{"engine_semantics_version":"0.4.0-next_open_basket","generated_at":"1970-01-01T00:00:00+08:00","schema_version":"1.0","signals":[{"all_negative_session":false,"bare_code":"518880","eligible":true,"momentum_score":1.644195151,"qmt_code":"518880.SH","r_squared":null,"selected_rank":1,"trading_date":"2026-01-06","trend_ok":true,"volume_surge":false},{"all_negative_session":false,"bare_code":"513880","eligible":true,"momentum_score":1.642396226,"qmt_code":"513880.SH","r_squared":null,"selected_rank":2,"trading_date":"2026-01-06","trend_ok":true,"volume_surge":false},{"all_negative_session":false,"bare_code":"159770","eligible":true,"momentum_score":1.640003473,"qmt_code":"159770.SZ","r_squared":null,"selected_rank":null,"trading_date":"2026-01-06","trend_ok":true,"volume_surge":false},{"all_negative_session":false,"bare_code":"159819","eligible":true,"momentum_score":1.628727852,"qmt_code":"159819.SZ","r_squared":null,"selected_rank":null,"trading_date":"2026-01-06","trend_ok":true,"volume_surge":false},{"all_negative_session":false,"bare_code":"513100","eligible":true,"momentum_score":1.639804376,"qmt_code":"513100.SH","r_squared":null,"selected_rank":null,"trading_date":"2026-01-06","trend_ok":true,"volume_surge":false},{"all_negative_session":false,"bare_code":"159915","eligible":true,"momentum_score":1.642196576,"qmt_code":"159915.SZ","r_squared":null,"selected_rank":3,"trading_date":"2026-01-06","trend_ok":true,"volume_surge":false},{"all_negative_session":false,"bare_code":"515880","eligible":true,"momentum_score":1.641597904,"qmt_code":"515880.SH","r_squared":null,"selected_rank":null,"trading_date":"2026-01-06","trend_ok":true,"volume_surge":false},{"all_negative_session":false,"bare_code":"513120","eligible":true,"momentum_score":1.638610759,"qmt_code":"513120.SH","r_squared":null,"selected_rank":null,"trading_date":"2026-01-06","trend_ok":true,"volume_surge":false},{"all_negative_session":false,"bare_code":"159755","eligible":true,"momentum_score":1.632272609,"qmt_code":"159755.SZ","r_squared":null,"selected_rank":null,"trading_date":"2026-01-06","trend_ok":true,"volume_surge":false},{"all_negative_session":false,"bare_code":"159652","eligible":true,"momentum_score":1.641797415,"qmt_code":"159652.SZ","r_squared":null,"selected_rank":null,"trading_date":"2026-01-06","trend_ok":true,"volume_surge":false},{"all_negative_session":false,"bare_code":"510500","eligible":true,"momentum_score":1.628334893,"qmt_code":"510500.SH","r_squared":null,"selected_rank":null,"trading_date":"2026-01-06","trend_ok":true,"volume_surge":false},{"all_negative_session":false,"bare_code":"159870","eligible":true,"momentum_score":1.634643943,"qmt_code":"159870.SZ","r_squared":null,"selected_rank":null,"trading_date":"2026-01-06","trend_ok":true,"volume_surge":false},{"all_negative_session":false,"bare_code":"159995","eligible":true,"momentum_score":1.634248266,"qmt_code":"159995.SZ","r_squared":null,"selected_rank":null,"trading_date":"2026-01-06","trend_ok":true,"volume_surge":false},{"all_negative_session":false,"bare_code":"518880","eligible":true,"momentum_score":1.644195151,"qmt_code":"518880.SH","r_squared":null,"selected_rank":1,"trading_date":"2026-01-07","trend_ok":true,"volume_surge":false},{"all_negative_session":false,"bare_code":"513880","eligible":true,"momentum_score":1.642396226,"qmt_code":"513880.SH","r_squared":null,"selected_rank":2,"trading_date":"2026-01-07","trend_ok":true,"volume_surge":false},{"all_negative_session":false,"bare_code":"159770","eligible":true,"momentum_score":1.640003473,"qmt_code":"159770.SZ","r_squared":null,"selected_rank":null,"trading_date":"2026-01-07","trend_ok":true,"volume_surge":false},{"all_negative_session":false,"bare_code":"159819","eligible":true,"momentum_score":1.628727852,"qmt_code":"159819.SZ","r_squared":null,"selected_rank":null,"trading_date":"2026-01-07","trend_ok":true,"volume_surge":false},{"all_negative_session":false,"bare_code":"513100","eligible":true,"momentum_score":1.639804376,"qmt_code":"513100.SH","r_squared":null,"selected_rank":null,"trading_date":"2026-01-07","trend_ok":true,"volume_surge":false},{"all_negative_session":false,"bare_code":"159915","eligible":true,"momentum_score":1.642196576,"qmt_code":"159915.SZ","r_squared":null,"selected_rank":3,"trading_date":"2026-01-07","trend_ok":true,"volume_surge":false},{"all_negative_session":false,"bare_code":"515880","eligible":true,"momentum_score":1.641597904,"qmt_code":"515880.SH","r_squared":null,"selected_rank":null,"trading_date":"2026-01-07","trend_ok":true,"volume_surge":false},{"all_negative_session":false,"bare_code":"513120","eligible":true,"momentum_score":1.638610759,"qmt_code":"513120.SH","r_squared":null,"selected_rank":null,"trading_date":"2026-01-07","trend_ok":true,"volume_surge":false},{"all_negative_session":false,"bare_code":"159755","eligible":true,"momentum_score":1.632272609,"qmt_code":"159755.SZ","r_squared":null,"selected_rank":null,"trading_date":"2026-01-07","trend_ok":true,"volume_surge":false},{"all_negative_session":false,"bare_code":"159652","eligible":true,"momentum_score":1.641797415,"qmt_code":"159652.SZ","r_squared":null,"selected_rank":null,"trading_date":"2026-01-07","trend_ok":true,"volume_surge":false},{"all_negative_session":false,"bare_code":"510500","eligible":true,"momentum_score":1.628334893,"qmt_code":"510500.SH","r_squared":null,"selected_rank":null,"trading_date":"2026-01-07","trend_ok":true,"volume_surge":false},{"all_negative_session":false,"bare_code":"159870","eligible":true,"momentum_score":1.634643943,"qmt_code":"159870.SZ","r_squared":null,"selected_rank":null,"trading_date":"2026-01-07","trend_ok":true,"volume_surge":false},{"all_negative_session":false,"bare_code":"159995","eligible":true,"momentum_score":1.634248266,"qmt_code":"159995.SZ","r_squared":null,"selected_rank":null,"trading_date":"2026-01-07","trend_ok":true,"volume_surge":false},{"all_negative_session":false,"bare_code":"518880","eligible":true,"momentum_score":1.644195151,"qmt_code":"518880.SH","r_squared":null,"selected_rank":1,"trading_date":"2026-01-08","trend_ok":true,"volume_surge":false},{"all_negative_session":false,"bare_code":"513880","eligible":true,"momentum_score":1.642396226,"qmt_code":"513880.SH","r_squared":null,"selected_rank":2,"trading_date":"2026-01-08","trend_ok":true,"volume_surge":false},{"all_negative_session":false,"bare_code":"159770","eligible":true,"momentum_score":1.640003473,"qmt_code":"159770.SZ","r_squared":null,"selected_rank":null,"trading_date":"2026-01-08","trend_ok":true,"volume_surge":false},{"all_negative_session":false,"bare_code":"159819","eligible":true,"momentum_score":1.628727852,"qmt_code":"159819.SZ","r_squared":null,"selected_rank":null,"trading_date":"2026-01-08","trend_ok":true,"volume_surge":false},{"all_negative_session":false,"bare_code":"513100","eligible":true,"momentum_score":1.639804376,"qmt_code":"513100.SH","r_squared":null,"selected_rank":null,"trading_date":"2026-01-08","trend_ok":true,"volume_surge":false},{"all_negative_session":false,"bare_code":"159915","eligible":true,"momentum_score":1.642196576,"qmt_code":"159915.SZ","r_squared":null,"selected_rank":3,"trading_date":"2026-01-08","trend_ok":true,"volume_surge":false},{"all_negative_session":false,"bare_code":"515880","eligible":true,"momentum_score":1.641597904,"qmt_code":"515880.SH","r_squared":null,"selected_rank":null,"trading_date":"2026-01-08","trend_ok":true,"volume_surge":false},{"all_negative_session":false,"bare_code":"513120","eligible":true,"momentum_score":1.638610759,"qmt_code":"513120.SH","r_squared":null,"selected_rank":null,"trading_date":"2026-01-08","trend_ok":true,"volume_surge":false},{"all_negative_session":false,"bare_code":"159755","eligible":true,"momentum_score":1.632272609,"qmt_code":"159755.SZ","r_squared":null,"selected_rank":null,"trading_date":"2026-01-08","trend_ok":true,"volume_surge":false},{"all_negative_session":false,"bare_code":"159652","eligible":true,"momentum_score":1.641797415,"qmt_code":"159652.SZ","r_squared":null,"selected_rank":null,"trading_date":"2026-01-08","trend_ok":true,"volume_surge":false},{"all_negative_session":false,"bare_code":"510500","eligible":true,"momentum_score":1.628334893,"qmt_code":"510500.SH","r_squared":null,"selected_rank":null,"trading_date":"2026-01-08","trend_ok":true,"volume_surge":false},{"all_negative_session":false,"bare_code":"159870","eligible":true,"momentum_score":1.634643943,"qmt_code":"159870.SZ","r_squared":null,"selected_rank":null,"trading_date":"2026-01-08","trend_ok":true,"volume_surge":false},{"all_negative_session":false,"bare_code":"159995","eligible":true,"momentum_score":1.634248266,"qmt_code":"159995.SZ","r_squared":null,"selected_rank":null,"trading_date":"2026-01-08","trend_ok":true,"volume_surge":false}],"source_digest_ref":"7f662b42ad18f9be855e4796c313b348c55527fc456c3e6c6fae6501e37b6fbe","strategy_id":"etf_regression_rotation_v1","timezone":"Asia/Shanghai"}